{"closure":"CLOSED_EXACT_PREFIX","event_count":"6","final_height":"6","final_state":{"controllers":[{"active_key":"0000000000000000000000000000000000000000000000000000000000000000","controller":"a68a07b4098feb1e59885cb596b5a005f4574a2ce205a76e562f358b6c28b90e","epoch":"3","head":"981b7849e2ef612d800877e01598363380e5c1dd143d0074e9b5a3be119294bf","recovery_keys":["82b77028a1af73c5f2ba9333f6640431263e86e389a5565ccf203e23463186a7","859a7f63b503e8db36ee6cb430c491e720cc7973a9cef9f37cab92d87155f19f","ac203c497116d567a698891682d6b68d3cf728cd09aa9f8fed35d32cbb443cb9"],"recovery_policy_hash":"8ec0eaddb3144d03bc8a3bd2778d7239c4bb78fd0f3b18b5ef102e4beedabd11","recovery_threshold":"2","retired_keys":["8caecf60c0552904bfb84289512012c229a99ca5604b08b56e20cc8fbd885fa6","b544f09dc4254933467044235a201ae86d8f09ef805d07183086faf9b9df3f0a","e84c519355c119e2d690f55caf5b894c153703ede4fb903dce9e03fec1f463d6"],"status":"LOCKED"},{"active_key":"a82c2c24af7605344e4748796027f736d52f15f5def7e2f1dbd262277512530f","controller":"e927bda7c914578716e2dbefa922f17c3b810e10307c76bb2b2ff075d7e8c0ad","epoch":"0","head":"0000000000000000000000000000000000000000000000000000000000000000","recovery_keys":["1eae61fdd12ba561e9f5f150cb0c9a7d3a2a9ad5eec09ad8398033bd2cfba9b1","8b98a41353cd1d8fd5042d173d9afb8bec4a05c207ec3a74bab0f2ff25522f5f","96a1ce0c170a8f820590f2bb58690856fccb8d93099ef01987248a4420d6829e"],"recovery_policy_hash":"5885e4401410b2649454e1ce663569bd896fe2e3f2855f91000b1e02ab1e8225","recovery_threshold":"2","retired_keys":[],"status":"ACTIVE"}],"height":"6","last_object_id":"981b7849e2ef612d800877e01598363380e5c1dd143d0074e9b5a3be119294bf","network":"NEXUS-R016-SYNTHETIC","profile":"CUSTODY-KERNEL-V1","status_authority":"NONE","utxos":[{"amount":"100","controller":"e927bda7c914578716e2dbefa922f17c3b810e10307c76bb2b2ff075d7e8c0ad","outpoint":"078a4e24a6e6bd5faa374257467c8a7bd3dcead58fda9ea0d70057134b19ed2e"},{"amount":"400","controller":"e927bda7c914578716e2dbefa922f17c3b810e10307c76bb2b2ff075d7e8c0ad","outpoint":"5193344940713f083d2d1d5c81d18a4990fd33d671e68aee9ca2d0480140b286"},{"amount":"500","controller":"a68a07b4098feb1e59885cb596b5a005f4574a2ce205a76e562f358b6c28b90e","outpoint":"b04b95589048754dba6d016bd6e905edd8ec202d681e6f296e18b01b0845a34d"}],"version":"1"},"final_state_root":"e272c98be2cd242d9a27762e256a5563cd7570e4a039e9bffe2bf1258587fb44","genesis_b64":"eyJjb250cm9sbGVycyI6W3siYWN0aXZlX2tleSI6ImI1NDRmMDlkYzQyNTQ5MzM0NjcwNDQyMzVhMjAxYWU4NmQ4ZjA5ZWY4MDVkMDcxODMwODZmYWY5YjlkZjNmMGEiLCJjb250cm9sbGVyIjoiYTY4YTA3YjQwOThmZWIxZTU5ODg1Y2I1OTZiNWEwMDVmNDU3NGEyY2UyMDVhNzZlNTYyZjM1OGI2YzI4YjkwZSIsInJlY292ZXJ5X2tleXMiOlsiODJiNzcwMjhhMWFmNzNjNWYyYmE5MzMzZjY2NDA0MzEyNjNlODZlMzg5YTU1NjVjY2YyMDNlMjM0NjMxODZhNyIsIjg1OWE3ZjYzYjUwM2U4ZGIzNmVlNmNiNDMwYzQ5MWU3MjBjYzc5NzNhOWNlZjlmMzdjYWI5MmQ4NzE1NWYxOWYiLCJhYzIwM2M0OTcxMTZkNTY3YTY5ODg5MTY4MmQ2YjY4ZDNjZjcyOGNkMDlhYTlmOGZlZDM1ZDMyY2JiNDQzY2I5Il19LHsiYWN0aXZlX2tleSI6ImE4MmMyYzI0YWY3NjA1MzQ0ZTQ3NDg3OTYwMjdmNzM2ZDUyZjE1ZjVkZWY3ZTJmMWRiZDI2MjI3NzUxMjUzMGYiLCJjb250cm9sbGVyIjoiZTkyN2JkYTdjOTE0NTc4NzE2ZTJkYmVmYTkyMmYxN2MzYjgxMGUxMDMwN2M3NmJiMmIyZmYwNzVkN2U4YzBhZCIsInJlY292ZXJ5X2tleXMiOlsiMWVhZTYxZmRkMTJiYTU2MWU5ZjVmMTUwY2IwYzlhN2QzYTJhOWFkNWVlYzA5YWQ4Mzk4MDMzYmQyY2ZiYTliMSIsIjhiOThhNDEzNTNjZDFkOGZkNTA0MmQxNzNkOWFmYjhiZWM0YTA1YzIwN2VjM2E3NGJhYjBmMmZmMjU1MjJmNWYiLCI5NmExY2UwYzE3MGE4ZjgyMDU5MGYyYmI1ODY5MDg1NmZjY2I4ZDkzMDk5ZWYwMTk4NzI0OGE0NDIwZDY4MjllIl19XSwia2luZCI6IkdFTkVTSVMiLCJuZXR3b3JrIjoiTkVYVVMtUjAxNi1TWU5USEVUSUMiLCJwcm9maWxlIjoiQ1VTVE9EWS1LRVJORUwtVjEiLCJzdGF0dXNfYXV0aG9yaXR5IjoiTk9ORSIsInV0eG9zIjpbeyJhbW91bnQiOiI2MDAiLCJjb250cm9sbGVyIjoiYTY4YTA3YjQwOThmZWIxZTU5ODg1Y2I1OTZiNWEwMDVmNDU3NGEyY2UyMDVhNzZlNTYyZjM1OGI2YzI4YjkwZSIsIm91dHBvaW50IjoiNDQ0MmE2MTBiZmZlM2FkZDljNWY1MTIzY2FjNzY3MGI0Y2Q0YjczOTdmZGFhMzRmMDI5MDY0YzU4MzVmZmRlMyJ9LHsiYW1vdW50IjoiNDAwIiwiY29udHJvbGxlciI6ImU5MjdiZGE3YzkxNDU3ODcxNmUyZGJlZmE5MjJmMTdjM2I4MTBlMTAzMDdjNzZiYjJiMmZmMDc1ZDdlOGMwYWQiLCJvdXRwb2ludCI6IjUxOTMzNDQ5NDA3MTNmMDgzZDJkMWQ1YzgxZDE4YTQ5OTBmZDMzZDY3MWU2OGFlZTljYTJkMDQ4MDE0MGIyODYifV0sInZlcnNpb24iOiIxIn0=","genesis_sha256":"f7e380ca05017cec42e9dd91cff1af38d0ed65896951ba5aedc5891709a2a43a","initial_state_root":"3c9cc0a0bad9df2d99ead2c109569b8ad4dff3a5df36a600ca2b7ee434f2013b","network":"NEXUS-R016-SYNTHETIC","profile":"CUSTODY-KERNEL-V1","records":[{"event_b64":"eyJjb250cm9sbGVyIjoiYTY4YTA3YjQwOThmZWIxZTU5ODg1Y2I1OTZiNWEwMDVmNDU3NGEyY2UyMDVhNzZlNTYyZjM1OGI2YzI4YjkwZSIsImNvbnRyb2xsZXJfZXBvY2giOiIwIiwiY29udHJvbGxlcl9oZWFkIjoiMDAwMDAwMDAwMDAwMDAwMDAwMDAwMDAwMDAwMDAwMDAwMDAwMDAwMDAwMDAwMDAwMDAwMDAwMDAwMDAwMDAwMCIsImlucHV0cyI6WyI0NDQyYTYxMGJmZmUzYWRkOWM1ZjUxMjNjYWM3NjcwYjRjZDRiNzM5N2ZkYWEzNGYwMjkwNjRjNTgzNWZmZGUzIl0sImtpbmQiOiJUUkFOU0ZFUiIsIm5ldHdvcmsiOiJORVhVUy1SMDE2LVNZTlRIRVRJQyIsIm9iamVjdF9pZCI6IjMzM2FjM2NkNGM2OTZiYmMxMWEzYjU3MGExNDFmMjEyNDE1Y2FjM2MzNWNmMzY3MTM5NTZlODRhMzdmY2ZiMjAiLCJvdXRwdXRzIjpbeyJhbW91bnQiOiI2MDAiLCJjb250cm9sbGVyIjoiYTY4YTA3YjQwOThmZWIxZTU5ODg1Y2I1OTZiNWEwMDVmNDU3NGEyY2UyMDVhNzZlNTYyZjM1OGI2YzI4YjkwZSJ9XSwicHJlZGVjZXNzb3IiOiIzYzljYzBhMGJhZDlkZjJkOTllYWQyYzEwOTU2OWI4YWQ0ZGZmM2E1ZGYzNmE2MDBjYTJiN2VlNDM0ZjIwMTNiIiwicHJvZmlsZSI6IkNVU1RPRFktS0VSTkVMLVYxIiwicHJvb2ZzIjpbeyJrZXkiOiJiNTQ0ZjA5ZGM0MjU0OTMzNDY3MDQ0MjM1YTIwMWFlODZkOGYwOWVmODA1ZDA3MTgzMDg2ZmFmOWI5ZGYzZjBhIiwib3V0cG9pbnQiOiI0NDQyYTYxMGJmZmUzYWRkOWM1ZjUxMjNjYWM3NjcwYjRjZDRiNzM5N2ZkYWEzNGYwMjkwNjRjNTgzNWZmZGUzIiwic2lnbmF0dXJlIjoiYjA1MDM1NDE5N2FhZjNkY2FmYzk2NzBlN2I1NWExNTgyMmJiMjg5OGY5ZGMwNmQyODA1YzBhNzNmMDkzYzIzOGI1NjkwYjFiNGFjNGFmZTQ2YjUzZGE0NDJmMDgyMzAzMWY2ZjVmZmEzOTkwMDNhYmRiOTI5NWE3M2QyMWViMDkifV0sInN0YXR1c19hdXRob3JpdHkiOiJOT05FIiwidmVyc2lvbiI6IjEifQ==","event_sha256":"6dfb7e271d8845a3a45ee47d45ff19b18bf4a73179b6b48591a8d4cf3f52d23f","kind":"TRANSFER","object_id":"333ac3cd4c696bbc11a3b570a141f212415cac3c35cf36713956e84a37fcfb20","receipt":{"after_root":"469eadaa44b8331a3bef935e12b4c9a79db771c46ff2bd479556ced31949be91","before_root":"3c9cc0a0bad9df2d99ead2c109569b8ad4dff3a5df36a600ca2b7ee434f2013b","height":"1","kind":"TRANSFER","object_id":"333ac3cd4c696bbc11a3b570a141f212415cac3c35cf36713956e84a37fcfb20","receipt_hash":"53cf0b7a5b4473c70399c689bd2680dbcd0edc50f149efecd23a74c4dc8eb0ac","result":"APPLIED","status_authority":"NONE"},"sequence":"1"},{"event_b64":"eyJjb250cm9sbGVyIjoiYTY4YTA3YjQwOThmZWIxZTU5ODg1Y2I1OTZiNWEwMDVmNDU3NGEyY2UyMDVhNzZlNTYyZjM1OGI2YzI4YjkwZSIsImNvbnRyb2xsZXJfZXBvY2giOiIwIiwiY29udHJvbGxlcl9oZWFkIjoiMDAwMDAwMDAwMDAwMDAwMDAwMDAwMDAwMDAwMDAwMDAwMDAwMDAwMDAwMDAwMDAwMDAwMDAwMDAwMDAwMDAwMCIsImtpbmQiOiJST1RBVEUiLCJuZXR3b3JrIjoiTkVYVVMtUjAxNi1TWU5USEVUSUMiLCJuZXdfa2V5IjoiZTg0YzUxOTM1NWMxMTllMmQ2OTBmNTVjYWY1Yjg5NGMxNTM3MDNlZGU0ZmI5MDNkY2U5ZTAzZmVjMWY0NjNkNiIsIm9iamVjdF9pZCI6IjEyZmUwMmJkYzM1OWE0MWI2MjQ5OWU3NmQ0NjUyYjlkMjJmOWJlZmRhZjUxNjNkMGZmNDE1M2Q2OWU1NWVjMmUiLCJwcmVkZWNlc3NvciI6IjQ2OWVhZGFhNDRiODMzMWEzYmVmOTM1ZTEyYjRjOWE3OWRiNzcxYzQ2ZmYyYmQ0Nzk1NTZjZWQzMTk0OWJlOTEiLCJwcm9maWxlIjoiQ1VTVE9EWS1LRVJORUwtVjEiLCJwcm9vZnMiOnsiYWN0aXZlIjp7ImtleSI6ImI1NDRmMDlkYzQyNTQ5MzM0NjcwNDQyMzVhMjAxYWU4NmQ4ZjA5ZWY4MDVkMDcxODMwODZmYWY5YjlkZjNmMGEiLCJzaWduYXR1cmUiOiJmMmFkMTk2YzMzZjgxOTMzNTA0YTkyMTMyMThhYTY5MmEzNWZiNTBiNDMxMjA0NGY3NDI4ZTNjYTVlZTVlMzZkZGY1MTkxN2E4YThkZGU2MWUxM2YzM2M2YmE1ZDUxYTMzN2MzMThmMzJjNmY0ZmU1YTNiNzM1OTdjZDJiMjEwZiJ9LCJndWFyZGlhbiI6eyJrZXkiOiI4MmI3NzAyOGExYWY3M2M1ZjJiYTkzMzNmNjY0MDQzMTI2M2U4NmUzODlhNTU2NWNjZjIwM2UyMzQ2MzE4NmE3Iiwic2lnbmF0dXJlIjoiODE2ZWVjNzU1NDJkZTViZDAxZTY0ZDViNzcyYmVkNjIxNDAzNzAxNWFjYjY5ZDA2ZWEzYWY0ZmFkMmMzZTkwMDQyMTkwNTZiMGU5Njg4MWY5MmQ1MmIyNjU1ODU1MDlhY2YyYTAwZjVmMjVkOWU1NWRmODNjNTA2NDBiZTQ0MDcifSwibmV3X2tleSI6eyJrZXkiOiJlODRjNTE5MzU1YzExOWUyZDY5MGY1NWNhZjViODk0YzE1MzcwM2VkZTRmYjkwM2RjZTllMDNmZWMxZjQ2M2Q2Iiwic2lnbmF0dXJlIjoiYTczYTYxY2JiNTM4ZjViNjdiZDg2NjAzYWQyZDY0MzA5NTU4MmMxMGM4YjJhYWIxNTQ2NjQ1MDRhN2YzYmYzZjA4ZTFhZDA3OGRkYTRiMWJhYzRhOTE1OTM4YmFiZTdkN2ViNDNjNTdiNjQ5YjU4MGM4YjkxMDBiZjU4OGFmMGQifX0sInN0YXR1c19hdXRob3JpdHkiOiJOT05FIiwidmVyc2lvbiI6IjEifQ==","event_sha256":"91163ba4e1e014387c4cad6a9129f416ea1dc751a0a4f15d205faac6bd48832e","kind":"ROTATE","object_id":"12fe02bdc359a41b62499e76d4652b9d22f9befdaf5163d0ff4153d69e55ec2e","receipt":{"after_root":"277bbf28ba651f54131870964710e945165a34d817e85b13fd2fc72c0db248ec","before_root":"469eadaa44b8331a3bef935e12b4c9a79db771c46ff2bd479556ced31949be91","height":"2","kind":"ROTATE","object_id":"12fe02bdc359a41b62499e76d4652b9d22f9befdaf5163d0ff4153d69e55ec2e","receipt_hash":"114dc7cdbbcfe9476521129f54ae1ace9ecea0ba91610c6ea07ae1c12babfac3","result":"APPLIED","status_authority":"NONE"},"sequence":"2"},{"event_b64":"eyJjb250cm9sbGVyIjoiYTY4YTA3YjQwOThmZWIxZTU5ODg1Y2I1OTZiNWEwMDVmNDU3NGEyY2UyMDVhNzZlNTYyZjM1OGI2YzI4YjkwZSIsImNvbnRyb2xsZXJfZXBvY2giOiIxIiwiY29udHJvbGxlcl9oZWFkIjoiMTJmZTAyYmRjMzU5YTQxYjYyNDk5ZTc2ZDQ2NTJiOWQyMmY5YmVmZGFmNTE2M2QwZmY0MTUzZDY5ZTU1ZWMyZSIsImlucHV0cyI6WyIyNTFhN2VlMzk2MzhkNzUwY2YxNGUxNDcyNTJiNTIyMzM0ZjQyZWM2NjQ5MzQyZjFkNjM3NTRkYjVmNWI5YWE1Il0sImtpbmQiOiJUUkFOU0ZFUiIsIm5ldHdvcmsiOiJORVhVUy1SMDE2LVNZTlRIRVRJQyIsIm9iamVjdF9pZCI6IjMzNDk5OGM0ODFjOTczMWM5NTg1MzQ1OTAwY2M3YTg4ZTkwNWQwYTM3MWJkZDU3ZTQxZmRhYTVmZWVhNzhkZTQiLCJvdXRwdXRzIjpbeyJhbW91bnQiOiI1MDAiLCJjb250cm9sbGVyIjoiYTY4YTA3YjQwOThmZWIxZTU5ODg1Y2I1OTZiNWEwMDVmNDU3NGEyY2UyMDVhNzZlNTYyZjM1OGI2YzI4YjkwZSJ9LHsiYW1vdW50IjoiMTAwIiwiY29udHJvbGxlciI6ImU5MjdiZGE3YzkxNDU3ODcxNmUyZGJlZmE5MjJmMTdjM2I4MTBlMTAzMDdjNzZiYjJiMmZmMDc1ZDdlOGMwYWQifV0sInByZWRlY2Vzc29yIjoiMjc3YmJmMjhiYTY1MWY1NDEzMTg3MDk2NDcxMGU5NDUxNjVhMzRkODE3ZTg1YjEzZmQyZmM3MmMwZGIyNDhlYyIsInByb2ZpbGUiOiJDVVNUT0RZLUtFUk5FTC1WMSIsInByb29mcyI6W3sia2V5IjoiZTg0YzUxOTM1NWMxMTllMmQ2OTBmNTVjYWY1Yjg5NGMxNTM3MDNlZGU0ZmI5MDNkY2U5ZTAzZmVjMWY0NjNkNiIsIm91dHBvaW50IjoiMjUxYTdlZTM5NjM4ZDc1MGNmMTRlMTQ3MjUyYjUyMjMzNGY0MmVjNjY0OTM0MmYxZDYzNzU0ZGI1ZjViOWFhNSIsInNpZ25hdHVyZSI6ImI2YjViODFjN2ZiNmZhNGFlMzZhZTZhZDYyNzIwMzBlMjAyYTUzN2MwNTdmYzBmNWIzNjI1ZDdjYWJhMTQxNTIzNzIxYjhiZDU5NTRkMTEyY2UyNWY0OWEyYWQ5NDEzNzgzOWIzMTIwNDViODQxODZmZDE0Njk0MGQzZGM2NjA4In1dLCJzdGF0dXNfYXV0aG9yaXR5IjoiTk9ORSIsInZlcnNpb24iOiIxIn0=","event_sha256":"9769665eda559fea4b050beb4f58819219f32f6661e610c4a0f5c82dbea58f9e","k